{
  "schema_version": "1.0",
  "request_id": "req_report_init_demo_001",
  "case": {
    "case_id": "VP-DEMO-001",
    "risk": "HIGH",
    "type": "검찰 사칭",
    "mode": "PREVENT",
    "status": "TRIAGE",
    "latest_summary": "검찰 사칭 및 긴급 송금 요구 정황이 확인됨"
  },
  "diagnosis": {
    "full_analysis": {
      "summary": "상대방은 검찰을 사칭하며 안전계좌 송금을 요구하고 있습니다.",
      "suspected_type": "검찰 사칭",
      "evidence": [
        {
          "source_type": "CASE_INPUT",
          "source_id": "input_demo_001",
          "quote": "검찰청 사건에 연루되셨으니 안전계좌로 송금하세요."
        }
      ]
    },
    "segments": [
      {
        "segment_id": "seg_demo_001",
        "text": "검찰청 사건에 연루되셨으니 안전계좌로 송금하세요.",
        "risk": "HIGH",
        "evidence": [
          {
            "source_type": "ANALYSIS_SEGMENT",
            "source_id": "seg_demo_001",
            "quote": "안전계좌로 송금하세요"
          }
        ]
      }
    ],
    "features": [
      {
        "feature_name": "impersonation",
        "feature_value": true,
        "evidence": [
          {
            "source_type": "CONTEXT_FEATURE",
            "source_id": "feature_demo_impersonation"
          }
        ]
      },
      {
        "feature_name": "transfer_request",
        "feature_value": true,
        "evidence": [
          {
            "source_type": "CONTEXT_FEATURE",
            "source_id": "feature_demo_transfer_request"
          }
        ]
      }
    ]
  }
}
